{
  "formatVersion": "0.2.0",
  "name": "Pip",
  "bones": [
    { "id": "root", "parent": null, "length": 0, "x": 0, "y": 0, "rotation": 0, "scaleX": 1, "scaleY": 1 },
    { "id": "Body", "parent": "root", "length": 60, "x": 0, "y": 0, "rotation": -90, "scaleX": 1, "scaleY": 1 },
    { "id": "Head", "parent": "Body", "length": 90, "x": 60, "y": 0, "rotation": 0, "scaleX": 1, "scaleY": 1 }
  ],
  "slots": [
    { "id": "Body", "bone": "Body", "attachment": "Body" },
    { "id": "Scarf", "bone": "Body", "attachment": "Scarf", "accessoryOf": "Body" },
    { "id": "Head", "bone": "Head", "attachment": "Head" },
    { "id": "Eyes", "bone": "Head", "attachment": "Open", "accessoryOf": "Head" },
    { "id": "Mouth", "bone": "Head", "attachment": "Closed", "accessoryOf": "Head" },
    { "id": "Hat", "bone": "Head", "attachment": "Hat", "accessoryOf": "Head" }
  ],
  "drawOrder": ["Body", "Scarf", "Head", "Eyes", "Mouth", "Hat"],
  "skins": {
    "default": {
      "Body": {
        "Body": {
          "type": "vector",
          "pivot": [0, 0],
          "shapes": [
            {
              "closed": true,
              "fill": "#6FB37AFF",
              "stroke": { "color": "#222222FF", "width": 3 },
              "points": [
                { "p": [70, -16], "in": [0, -13.2548], "out": [0, 0] },
                { "p": [70, 16], "in": [0, 0], "out": [0, 13.2548] },
                { "p": [46, 40], "in": [13.2548, 0], "out": [0, 0] },
                { "p": [4, 40], "in": [0, 0], "out": [-13.2548, 0] },
                { "p": [-20, 16], "in": [0, 13.2548], "out": [0, 0] },
                { "p": [-20, -16], "in": [0, 0], "out": [0, -13.2548] },
                { "p": [4, -40], "in": [-13.2548, 0], "out": [0, 0] },
                { "p": [46, -40], "in": [0, 0], "out": [13.2548, 0] }
              ]
            }
          ]
        }
      },
      "Head": {
        "Head": {
          "type": "vector",
          "pivot": [0, 0],
          "shapes": [
            {
              "closed": true,
              "fill": "#F6C9A0FF",
              "stroke": { "color": "#222222FF", "width": 3 },
              "points": [
                { "p": [96, 0], "in": [0, -27.6142], "out": [0, 27.6142], "symmetric": true },
                { "p": [50, 50], "in": [25.4051, 0], "out": [-25.4051, 0], "symmetric": true },
                { "p": [4, 0], "in": [0, 27.6142], "out": [0, -27.6142], "symmetric": true },
                { "p": [50, -50], "in": [-25.4051, 0], "out": [25.4051, 0], "symmetric": true }
              ]
            }
          ]
        }
      },
      "Eyes": {
        "Open": {
          "type": "vector",
          "pivot": [55, 0],
          "shapes": [
            {
              "closed": true,
              "fill": "#222222FF",
              "points": [
                { "p": [66, -18], "in": [0, -3.3137], "out": [0, 3.3137], "symmetric": true },
                { "p": [58, -12], "in": [4.4183, 0], "out": [-4.4183, 0], "symmetric": true },
                { "p": [50, -18], "in": [0, 3.3137], "out": [0, -3.3137], "symmetric": true },
                { "p": [58, -24], "in": [-4.4183, 0], "out": [4.4183, 0], "symmetric": true }
              ]
            },
            {
              "closed": true,
              "fill": "#222222FF",
              "points": [
                { "p": [66, 18], "in": [0, -3.3137], "out": [0, 3.3137], "symmetric": true },
                { "p": [58, 24], "in": [4.4183, 0], "out": [-4.4183, 0], "symmetric": true },
                { "p": [50, 18], "in": [0, 3.3137], "out": [0, -3.3137], "symmetric": true },
                { "p": [58, 12], "in": [-4.4183, 0], "out": [4.4183, 0], "symmetric": true }
              ]
            }
          ]
        },
        "Blink": {
          "type": "vector",
          "pivot": [55, 0],
          "shapes": [
            {
              "closed": false,
              "stroke": { "color": "#222222FF", "width": 3 },
              "points": [
                { "p": [58, -25], "in": [0, 0], "out": [0, 0], "smooth": false },
                { "p": [58, -11], "in": [0, 0], "out": [0, 0], "smooth": false }
              ]
            },
            {
              "closed": false,
              "stroke": { "color": "#222222FF", "width": 3 },
              "points": [
                { "p": [58, 11], "in": [0, 0], "out": [0, 0], "smooth": false },
                { "p": [58, 25], "in": [0, 0], "out": [0, 0], "smooth": false }
              ]
            }
          ]
        }
      },
      "Mouth": {
        "Closed": {
          "type": "vector",
          "pivot": [28, 0],
          "shapes": [
            {
              "closed": false,
              "stroke": { "color": "#222222FF", "width": 3 },
              "points": [
                { "p": [28, -14], "in": [0, 0], "out": [0, 0], "smooth": false },
                { "p": [28, 14], "in": [0, 0], "out": [0, 0], "smooth": false }
              ]
            }
          ]
        },
        "Open": {
          "type": "vector",
          "pivot": [28, 0],
          "shapes": [
            {
              "closed": true,
              "fill": "#B04A4AFF",
              "stroke": { "color": "#222222FF", "width": 3 },
              "points": [
                { "p": [34, 0], "in": [0, -8.2843], "out": [0, 8.2843], "symmetric": true },
                { "p": [26, 15], "in": [4.4183, 0], "out": [-4.4183, 0], "symmetric": true },
                { "p": [18, 0], "in": [0, 8.2843], "out": [0, -8.2843], "symmetric": true },
                { "p": [26, -15], "in": [-4.4183, 0], "out": [4.4183, 0], "symmetric": true }
              ]
            }
          ]
        },
        "O": {
          "type": "vector",
          "pivot": [28, 0],
          "shapes": [
            {
              "closed": true,
              "fill": "#B04A4AFF",
              "stroke": { "color": "#222222FF", "width": 3 },
              "points": [
                { "p": [35, 0], "in": [0, -3.866], "out": [0, 3.866], "symmetric": true },
                { "p": [26, 7], "in": [4.9706, 0], "out": [-4.9706, 0], "symmetric": true },
                { "p": [17, 0], "in": [0, 3.866], "out": [0, -3.866], "symmetric": true },
                { "p": [26, -7], "in": [-4.9706, 0], "out": [4.9706, 0], "symmetric": true }
              ]
            }
          ]
        }
      },
      "Hat": {
        "Hat": {
          "type": "vector",
          "pivot": [90, 0],
          "shapes": [
            {
              "closed": true,
              "fill": "#222222FF",
              "points": [
                { "p": [140, -30], "in": [0, 0], "out": [0, 0], "smooth": false },
                { "p": [140, 30], "in": [0, 0], "out": [0, 0], "smooth": false },
                { "p": [90, 30], "in": [0, 0], "out": [0, 0], "smooth": false },
                { "p": [90, -30], "in": [0, 0], "out": [0, 0], "smooth": false }
              ]
            },
            {
              "closed": true,
              "fill": "#222222FF",
              "points": [
                { "p": [96, -42], "in": [0, -2.2091], "out": [0, 0] },
                { "p": [96, 42], "in": [0, 0], "out": [0, 2.2091] },
                { "p": [92, 46], "in": [2.2091, 0], "out": [-2.2091, 0] },
                { "p": [88, 42], "in": [0, 2.2091], "out": [0, 0] },
                { "p": [88, -42], "in": [0, 0], "out": [0, -2.2091] },
                { "p": [92, -46], "in": [-2.2091, 0], "out": [2.2091, 0] }
              ]
            }
          ]
        }
      }
    },
    "Winter": {
      "Scarf": {
        "Scarf": {
          "type": "vector",
          "pivot": [62, 0],
          "shapes": [
            {
              "closed": true,
              "fill": "#D9534FFF",
              "stroke": { "color": "#222222FF", "width": 3 },
              "points": [
                { "p": [72, -35], "in": [0, -4.9706], "out": [0, 0] },
                { "p": [72, 35], "in": [0, 0], "out": [0, 4.9706] },
                { "p": [63, 44], "in": [4.9706, 0], "out": [-4.9706, 0] },
                { "p": [54, 35], "in": [0, 4.9706], "out": [0, 0] },
                { "p": [54, -35], "in": [0, 0], "out": [0, -4.9706] },
                { "p": [63, -44], "in": [-4.9706, 0], "out": [4.9706, 0] }
              ]
            },
            {
              "closed": true,
              "fill": "#D9534FFF",
              "stroke": { "color": "#222222FF", "width": 3 },
              "points": [
                { "p": [60, 20], "in": [0, -3.3137], "out": [0, 0] },
                { "p": [60, 24], "in": [0, 0], "out": [0, 3.3137] },
                { "p": [54, 30], "in": [3.3137, 0], "out": [0, 0] },
                { "p": [26, 30], "in": [0, 0], "out": [-3.3137, 0] },
                { "p": [20, 24], "in": [0, 3.3137], "out": [0, 0] },
                { "p": [20, 20], "in": [0, 0], "out": [0, -3.3137] },
                { "p": [26, 14], "in": [-3.3137, 0], "out": [0, 0] },
                { "p": [54, 14], "in": [0, 0], "out": [3.3137, 0] }
              ]
            }
          ]
        }
      },
      "Hat": {
        "Hat": {
          "type": "vector",
          "pivot": [90, 0],
          "shapes": [
            {
              "closed": true,
              "fill": "#D9534FFF",
              "stroke": { "color": "#222222FF", "width": 3 },
              "points": [
                { "p": [120, 0], "in": [0, -26.5097], "out": [0, 26.5097], "symmetric": true },
                { "p": [90, 48], "in": [16.5685, 0], "out": [-16.5685, 0], "symmetric": true },
                { "p": [60, 0], "in": [0, 26.5097], "out": [0, -26.5097], "symmetric": true },
                { "p": [90, -48], "in": [-16.5685, 0], "out": [16.5685, 0], "symmetric": true }
              ]
            },
            {
              "closed": true,
              "fill": "#F2F2F2FF",
              "stroke": { "color": "#222222FF", "width": 3 },
              "points": [